ID;PortalCode;Region;Town;Street;Number;FullAddress
1;652050;Кемеровская область;город Юрга;ул. Лесная;15;652050, Кемеровская область, город Юрга, ул. Лесная, 15
2;164500;Архангельская область;город Северодвинск;ул. Строителей;18;164500, Архангельская область, город Северодвинск, ул. Строителей, 18
3;188910;Ленинградская область;город Приморск;ул. Парковая;21;188910, Ленинградская область, город Приморск, ул. Парковая, 21
4;143960;Московская область;город Реутов;ул. Свободы;51;143960, Московская область, город Реутов, ул. Свободы, 51
5;309500;Белгородская область;город Старый Оскол;ул. Рабочая;122;309500, Белгородская область, город Старый Оскол, ул. Рабочая, 122
